CREATE EXTENSION pg_textsearch;

SET default_text_search_config = 'pg_catalog.english';

CREATE TABLE boolean_docs (
    id integer PRIMARY KEY,
    body text NOT NULL
);

INSERT INTO boolean_docs VALUES
    (1, 'refund approved'),
    (2, 'refund fraud'),
    (3, 'fraud refund investigation'),
    (4, 'billing refund request'),
    (5, 'billing question'),
    (8, ''),
    (9, 'the');

SET client_min_messages = WARNING;
CREATE INDEX boolean_docs_body_idx ON boolean_docs USING bm25(body)
    WITH (text_config = 'english');
RESET client_min_messages;

INSERT INTO boolean_docs VALUES
    (6, 'refund fraud followup'),
    (7, 'refund suspected fraud');

SET enable_seqscan = off;

SET pg_textsearch.memtable_cache_enabled = off;
SELECT id
FROM boolean_docs
WHERE body @@ to_tsquery('english', '!fraud')
ORDER BY id;
 id 
----
  1
  4
  5
  8
  9
(5 rows)

RESET pg_textsearch.memtable_cache_enabled;

EXPLAIN (COSTS OFF)
SELECT id
FROM boolean_docs
WHERE body @@ to_tsquery('english', 'refund & fraud');
                        QUERY PLAN                         
-----------------------------------------------------------
 Index Scan using boolean_docs_body_idx on boolean_docs
   Index Cond: (body @@ '''refund'' & ''fraud'''::tsquery)
(2 rows)


SELECT id
FROM boolean_docs
WHERE body @@ to_tsquery('english', 'refund & fraud')
ORDER BY id;
 id 
----
  2
  3
  6
  7
(4 rows)


SELECT id
FROM boolean_docs
WHERE body @@ to_tsquery('english', 'refund | fraud')
ORDER BY id;
 id 
----
  1
  2
  3
  4
  6
  7
(6 rows)


SELECT id
FROM boolean_docs
WHERE body @@ to_tsquery('english', 'refund & !fraud')
ORDER BY id;
 id 
----
  1
  4
(2 rows)


SELECT id
FROM boolean_docs
WHERE body @@ to_tsquery('english', 'billing & (refund | !question)')
ORDER BY id;
 id 
----
  4
(1 row)


SELECT id
FROM boolean_docs
WHERE body @@ to_tsquery('english', 'refund <-> fraud')
ORDER BY id;
 id 
----
  2
  6
(2 rows)


SELECT id
FROM boolean_docs
WHERE body @@ to_tsquery('english', '!fraud')
ORDER BY id;
 id 
----
  1
  4
  5
  8
  9
(5 rows)


SELECT id
FROM boolean_docs
WHERE body @@ to_tsquery('english', 'refund | !fraud')
ORDER BY id;
 id 
----
  1
  2
  3
  4
  5
  6
  7
  8
  9
(9 rows)


SELECT id
FROM boolean_docs
WHERE body @@ to_tsquery('english', '!(refund <-> fraud)')
ORDER BY id;
 id 
----
  1
  3
  4
  5
  7
  8
  9
(7 rows)


SELECT id
FROM boolean_docs
WHERE body @@ to_tsquery('english', 'refund:*')
ORDER BY id;
 id 
----
  1
  2
  3
  4
  6
  7
(6 rows)


SELECT id
FROM boolean_docs
WHERE body @@ to_tsquery('english', 'refund:A')
ORDER BY id;
 id 
----
(0 rows)


SET plan_cache_mode = force_generic_plan;
PREPARE boolean_scan(tsquery) AS
SELECT id
FROM boolean_docs
WHERE body @@ $1
ORDER BY id;

EXPLAIN (COSTS OFF)
EXECUTE boolean_scan(to_tsquery('english', 'refund & !fraud'));
                          QUERY PLAN                          
--------------------------------------------------------------
 Sort
   Sort Key: id
   ->  Index Scan using boolean_docs_body_idx on boolean_docs
         Index Cond: (body @@ $1)
(4 rows)


EXECUTE boolean_scan(to_tsquery('english', 'refund & fraud'));
 id 
----
  2
  3
  6
  7
(4 rows)

EXECUTE boolean_scan(to_tsquery('english', '!fraud'));
 id 
----
  1
  4
  5
  8
  9
(5 rows)

EXECUTE boolean_scan(to_tsquery('english', 'refund <-> fraud'));
 id 
----
  2
  6
(2 rows)

EXECUTE boolean_scan(to_tsquery('english', 'refund:*'));
 id 
----
  1
  2
  3
  4
  6
  7
(6 rows)


SET default_text_search_config = 'pg_catalog.simple';
EXECUTE boolean_scan(NULL);
 id 
----
(0 rows)

EXECUTE boolean_scan(to_tsquery('simple', 'refund & fraud'));
ERROR:  BM25 index "boolean_docs_body_idx" cannot evaluate text search configuration "simple"
DETAIL:  The index uses text search configuration "english".
HINT:  Set default_text_search_config to match the index or use a different index.
DEALLOCATE boolean_scan;
RESET plan_cache_mode;

RESET enable_seqscan;
EXPLAIN (COSTS OFF)
SELECT id
FROM boolean_docs
WHERE body @@ to_tsquery('simple', 'refund & fraud');
                      QUERY PLAN                       
-------------------------------------------------------
 Seq Scan on boolean_docs
   Filter: (body @@ '''refund'' & ''fraud'''::tsquery)
(2 rows)

SET enable_seqscan = off;

SET default_text_search_config = 'pg_catalog.english';
SET client_min_messages = WARNING;
SELECT id
FROM boolean_docs
WHERE body @@ to_tsquery('english', '')
ORDER BY id;
 id 
----
(0 rows)


SELECT id
FROM boolean_docs
WHERE body @@ to_tsquery('english', 'the')
ORDER BY id;
 id 
----
(0 rows)

RESET client_min_messages;

UPDATE boolean_docs
SET body = 'billing fraud question'
WHERE id = 5;
DELETE FROM boolean_docs WHERE id = 1;
VACUUM boolean_docs;

SELECT id
FROM boolean_docs
WHERE body @@ to_tsquery('english', '!fraud')
ORDER BY id;
 id 
----
  4
  8
  9
(3 rows)


SELECT id
FROM boolean_docs
WHERE body @@ to_tsquery('english', 'refund & !fraud')
ORDER BY id;
 id 
----
  4
(1 row)


RESET enable_seqscan;
RESET default_text_search_config;

DROP TABLE boolean_docs;

CREATE TABLE boolean_empty_docs (
    id integer PRIMARY KEY,
    body text NOT NULL
);

SET client_min_messages = WARNING;
CREATE INDEX boolean_empty_docs_body_idx ON boolean_empty_docs USING bm25(body)
    WITH (text_config = 'english');
RESET client_min_messages;

INSERT INTO boolean_empty_docs VALUES
    (1, ''),
    (2, 'the');

SET enable_seqscan = off;
SET pg_textsearch.memtable_cache_enabled = off;
SELECT id
FROM boolean_empty_docs
WHERE body @@ to_tsquery('english', '!missing')
ORDER BY id;
 id 
----
  1
  2
(2 rows)

RESET pg_textsearch.memtable_cache_enabled;

SELECT bm25_spill_index('boolean_empty_docs_body_idx') IS NOT NULL
    AS spilled_empty_docs;
 spilled_empty_docs 
--------------------
 t
(1 row)


INSERT INTO boolean_empty_docs VALUES
    (3, ''),
    (4, 'the');

SELECT bm25_spill_index('boolean_empty_docs_body_idx') IS NOT NULL
    AS spilled_more_empty_docs;
 spilled_more_empty_docs 
-------------------------
 t
(1 row)

SELECT bm25_force_merge('boolean_empty_docs_body_idx');
 bm25_force_merge 
------------------
 
(1 row)


SELECT id
FROM boolean_empty_docs
WHERE body @@ to_tsquery('english', '!missing')
ORDER BY id;
 id 
----
  1
  2
  3
  4
(4 rows)


RESET enable_seqscan;
DROP TABLE boolean_empty_docs;

CREATE TABLE boolean_segment_docs (
    id integer PRIMARY KEY,
    body text NOT NULL
);

INSERT INTO boolean_segment_docs VALUES
    (1, 'alpha beta'),
    (2, 'alpha'),
    (3, 'beta');

SET client_min_messages = WARNING;
CREATE INDEX boolean_segment_docs_body_idx
    ON boolean_segment_docs USING bm25(body)
    WITH (text_config = 'english');
RESET client_min_messages;

INSERT INTO boolean_segment_docs VALUES
    (4, 'gamma delta'),
    (5, 'gamma'),
    (6, 'delta'),
    (7, 'alpha gamma');

SELECT bm25_spill_index('boolean_segment_docs_body_idx') IS NOT NULL
    AS spilled_segment_docs;
 spilled_segment_docs 
----------------------
 t
(1 row)


INSERT INTO boolean_segment_docs VALUES
    (8, 'alpha delta'),
    (9, 'beta gamma'),
    (10, 'epsilon');

DELETE FROM boolean_segment_docs WHERE id = 2;
VACUUM boolean_segment_docs;

SET enable_seqscan = off;

SELECT array_agg(id ORDER BY id) AS nested_matches
FROM boolean_segment_docs
WHERE body @@ to_tsquery('english', '(alpha & beta) | (gamma & delta)');
 nested_matches 
----------------
 {1,4}
(1 row)


SELECT array_agg(id ORDER BY id) AS anchored_not_matches
FROM boolean_segment_docs
WHERE body @@ to_tsquery('english', 'alpha & !gamma');
 anchored_not_matches 
----------------------
 {1,8}
(1 row)


SELECT array_agg(id ORDER BY id) AS duplicate_term_matches
FROM boolean_segment_docs
WHERE body @@ to_tsquery('english', 'alpha | alpha');
 duplicate_term_matches 
------------------------
 {1,7,8}
(1 row)


SELECT count(*) AS missing_and_matches
FROM boolean_segment_docs
WHERE body @@ to_tsquery('english', 'alpha & missing');
 missing_and_matches 
---------------------
                   0
(1 row)


SELECT array_agg(id ORDER BY id) AS mixed_source_matches
FROM boolean_segment_docs
WHERE body @@ to_tsquery('english', 'alpha | epsilon');
 mixed_source_matches 
----------------------
 {1,7,8,10}
(1 row)


SELECT array_agg(id ORDER BY id) AS pure_negative_matches
FROM boolean_segment_docs
WHERE body @@ to_tsquery('english', '!missing');
 pure_negative_matches 
-----------------------
 {1,3,4,5,6,7,8,9,10}
(1 row)


SELECT array_agg(id ORDER BY id) AS phrase_matches
FROM boolean_segment_docs
WHERE body @@ to_tsquery('english', 'alpha <-> beta');
 phrase_matches 
----------------
 {1}
(1 row)


RESET enable_seqscan;
DROP TABLE boolean_segment_docs;
DROP EXTENSION pg_textsearch;
