-- Expression index tests for pg_textsearch
CREATE EXTENSION IF NOT EXISTS pg_textsearch;
INFO:  pg_textsearch v1.0.0-dev
-- ============================================================
-- JSONB expression index
-- ============================================================
CREATE TABLE expr_jsonb (
    id SERIAL PRIMARY KEY,
    data JSONB
);
INSERT INTO expr_jsonb (data) VALUES
    ('{"content": "postgresql database management system"}'),
    ('{"content": "machine learning algorithms"}'),
    ('{"content": "full text search and retrieval"}');
CREATE INDEX expr_jsonb_idx ON expr_jsonb
    USING bm25 ((data->>'content'))
    WITH (text_config='english');
NOTICE:  BM25 index build started for relation expr_jsonb_idx
NOTICE:  Using text search configuration: english
NOTICE:  Using index options: k1=1.20, b=0.75
NOTICE:  BM25 index build completed: 3 documents, avg_length=3.67
SET enable_seqscan = off;
-- Query with explicit index naming
SELECT id,
       ROUND(((data->>'content') <@>
              to_bm25query('database', 'expr_jsonb_idx'))::numeric, 4)
              AS score
FROM expr_jsonb
ORDER BY (data->>'content') <@>
         to_bm25query('database', 'expr_jsonb_idx')
LIMIT 5;
 id |  score  
----+---------
  1 | -0.9457
(1 row)

-- ============================================================
-- Multi-column concatenation expression index
-- ============================================================
CREATE TABLE expr_concat (
    id SERIAL PRIMARY KEY,
    title TEXT,
    body TEXT
);
INSERT INTO expr_concat (title, body) VALUES
    ('Database Systems', 'An introduction to relational databases'),
    ('Machine Learning', 'Algorithms for pattern recognition'),
    ('Search Engines', 'Full text search and information retrieval');
CREATE INDEX expr_concat_idx ON expr_concat
    USING bm25 ((coalesce(title, '') || ' ' || coalesce(body, '')))
    WITH (text_config='english');
NOTICE:  BM25 index build started for relation expr_concat_idx
NOTICE:  Using text search configuration: english
NOTICE:  Using index options: k1=1.20, b=0.75
NOTICE:  BM25 index build completed: 3 documents, avg_length=5.67
SELECT id,
       ROUND(((coalesce(title, '') || ' ' || coalesce(body, '')) <@>
              to_bm25query('database', 'expr_concat_idx'))::numeric, 4)
              AS score
FROM expr_concat
ORDER BY (coalesce(title, '') || ' ' || coalesce(body, '')) <@>
         to_bm25query('database', 'expr_concat_idx')
LIMIT 5;
 id |  score  
----+---------
  1 | -1.3948
(1 row)

-- ============================================================
-- Simple transformation expression index
-- ============================================================
CREATE TABLE expr_lower (
    id SERIAL PRIMARY KEY,
    content TEXT
);
INSERT INTO expr_lower (content) VALUES
    ('PostgreSQL Database Management'),
    ('Machine Learning Algorithms'),
    ('Full Text Search and Retrieval');
CREATE INDEX expr_lower_idx ON expr_lower
    USING bm25 ((lower(content)))
    WITH (text_config='simple');
NOTICE:  BM25 index build started for relation expr_lower_idx
NOTICE:  Using text search configuration: simple
NOTICE:  Using index options: k1=1.20, b=0.75
NOTICE:  BM25 index build completed: 3 documents, avg_length=3.67
SELECT id,
       ROUND(((lower(content)) <@>
              to_bm25query('database', 'expr_lower_idx'))::numeric, 4)
              AS score
FROM expr_lower
ORDER BY (lower(content)) <@>
         to_bm25query('database', 'expr_lower_idx')
LIMIT 5;
 id |  score  
----+---------
  1 | -1.0596
(1 row)

-- ============================================================
-- Implicit resolution (no explicit index name)
-- ============================================================
SELECT id,
       ROUND(((data->>'content') <@>
              to_bm25query('database'))::numeric, 4) AS score
FROM expr_jsonb
ORDER BY (data->>'content') <@> to_bm25query('database')
LIMIT 5;
 id |  score  
----+---------
  1 | -0.9457
(1 row)

-- ============================================================
-- Verify index scan is used
-- ============================================================
EXPLAIN (COSTS OFF)
SELECT id
FROM expr_jsonb
ORDER BY (data->>'content') <@>
         to_bm25query('database', 'expr_jsonb_idx')
LIMIT 5;
                                       QUERY PLAN                                        
-----------------------------------------------------------------------------------------
 Limit
   ->  Index Scan using expr_jsonb_idx on expr_jsonb
         Order By: ((data ->> 'content'::text) <@> 'expr_jsonb_idx:database'::bm25query)
(3 rows)

-- ============================================================
-- NULL handling: row with missing JSONB key
-- ============================================================
INSERT INTO expr_jsonb (data) VALUES
    ('{"other_field": "no content key"}'),
    (NULL);
-- These should not affect results
SELECT id,
       ROUND(((data->>'content') <@>
              to_bm25query('database',
                           'expr_jsonb_idx'))::numeric, 4)
              AS score
FROM expr_jsonb
ORDER BY (data->>'content') <@>
         to_bm25query('database', 'expr_jsonb_idx')
LIMIT 5;
 id |  score  
----+---------
  1 | -0.9457
(1 row)

-- ============================================================
-- Delete a document and verify index still works
-- ============================================================
DELETE FROM expr_jsonb WHERE id = 1;
SELECT id,
       ROUND(((data->>'content') <@>
              to_bm25query('search',
                           'expr_jsonb_idx'))::numeric, 4)
              AS score
FROM expr_jsonb
ORDER BY (data->>'content') <@>
         to_bm25query('search', 'expr_jsonb_idx')
LIMIT 5;
 id |  score  
----+---------
  3 | -0.9457
(1 row)

-- ============================================================
-- VACUUM: delete rows and vacuum to exercise rebuild
-- ============================================================
DELETE FROM expr_jsonb WHERE id <= 2;
VACUUM expr_jsonb;
-- Verify index still works after vacuum
SELECT id,
       ROUND(((data->>'content') <@>
              to_bm25query('search',
                           'expr_jsonb_idx'))::numeric, 4)
              AS score
FROM expr_jsonb
ORDER BY (data->>'content') <@>
         to_bm25query('search', 'expr_jsonb_idx')
LIMIT 5;
 id |  score  
----+---------
  3 | -0.9457
(1 row)

-- ============================================================
-- Partitioned table with expression index
-- ============================================================
CREATE TABLE expr_part (
    id SERIAL,
    data JSONB,
    created_at DATE NOT NULL
) PARTITION BY RANGE (created_at);
CREATE TABLE expr_part_2024 PARTITION OF expr_part
    FOR VALUES FROM ('2024-01-01') TO ('2025-01-01');
CREATE TABLE expr_part_2025 PARTITION OF expr_part
    FOR VALUES FROM ('2025-01-01') TO ('2026-01-01');
INSERT INTO expr_part (data, created_at) VALUES
    ('{"text": "database management systems"}',
     '2024-06-15'),
    ('{"text": "machine learning algorithms"}',
     '2024-09-20'),
    ('{"text": "search engine optimization"}',
     '2025-03-10');
CREATE INDEX expr_part_idx ON expr_part
    USING bm25 ((data->>'text'))
    WITH (text_config='english');
NOTICE:  BM25 index build started for relation expr_part_2024_expr_idx
NOTICE:  Using text search configuration: english
NOTICE:  Using index options: k1=1.20, b=0.75
NOTICE:  BM25 index build completed: 3 documents across 2 partitions, avg_length=3.00
SELECT id,
       ROUND(((data->>'text') <@>
              to_bm25query('database',
                           'expr_part_idx'))::numeric,
             4) AS score
FROM expr_part
ORDER BY (data->>'text') <@>
         to_bm25query('database', 'expr_part_idx')
LIMIT 5;
 id |  score  
----+---------
  1 | -0.6931
(1 row)

DROP TABLE expr_part CASCADE;
-- ============================================================
-- Multiple expression indexes trigger warning
-- ============================================================
CREATE INDEX expr_jsonb_idx2 ON expr_jsonb
    USING bm25 ((data->>'content'))
    WITH (text_config='simple');
NOTICE:  BM25 index build started for relation expr_jsonb_idx2
NOTICE:  Using text search configuration: simple
NOTICE:  Using index options: k1=1.20, b=0.75
NOTICE:  BM25 index build completed: 1 documents, avg_length=5.00
-- Implicit resolution should warn about multiple indexes
SELECT id,
       ROUND(((data->>'content') <@>
              to_bm25query('database'))::numeric, 4)
              AS score
FROM expr_jsonb
ORDER BY (data->>'content') <@> to_bm25query('database')
LIMIT 3;
WARNING:  multiple BM25 indexes match the expression
HINT:  Use explicit to_bm25query('query', 'index_name') to specify which index.
WARNING:  multiple BM25 indexes match the expression
HINT:  Use explicit to_bm25query('query', 'index_name') to specify which index.
WARNING:  planner chose index "expr_jsonb_idx2" instead of "expr_jsonb_idx"
HINT:  If this is not desired, use a planner hint to force a specific index, or use explicit to_bm25query('query', 'index_name').
 id | score 
----+-------
(0 rows)

DROP INDEX expr_jsonb_idx2;
-- ============================================================
-- Error case: non-text expression type
-- ============================================================
\set ON_ERROR_STOP off
CREATE INDEX expr_bad_idx ON expr_lower
    USING bm25 ((length(content)))
    WITH (text_config='simple');
ERROR:  data type integer has no default operator class for access method "bm25"
HINT:  You must specify an operator class for the index or define a default operator class for the data type.
\set ON_ERROR_STOP on
-- ============================================================
-- Cleanup
-- ============================================================
DROP TABLE expr_jsonb CASCADE;
DROP TABLE expr_concat CASCADE;
DROP TABLE expr_lower CASCADE;
DROP EXTENSION pg_textsearch CASCADE;
