-- Regression: Step 2 FSM reclaim of DEAD memtable orphans.
-- After spill + VACUUM, tp_reclaim_dead_memtable_pages returns blocks
-- to the index FSM; tp_memtable_alloc_page should reuse them when the
-- chain grows again (main fork should not grow by ~one block per dead
-- page if reuse works).
CREATE EXTENSION IF NOT EXISTS pg_textsearch;
-- True when the cluster's reclaim horizon may be pinned, which defers FSM
-- reclaim.  GetOldestNonRemovableTransactionId() is held back by anything
-- ComputeXidHorizons() folds into data_oldest_nonremovable (procarray.c):
-- an xmin-holding backend in our database, a backend flagged
-- PROC_AFFECTS_ALL_HORIZONS, a replication slot xmin, or a prepared xact.
-- A standby with hot_standby_feedback = on publishes its xmin through the
-- slot, not pg_stat_activity, so checking only client backends misses it.
-- While pinned, deleted tuples stay HEAPTUPLE_RECENTLY_DEAD: VACUUM must
-- retain them, and index builds must still index them to preserve MVCC.
-- Counts taken after a DELETE are then meaningless, so dependent
-- assertions are skipped rather than relaxed.
CREATE FUNCTION horizon_pinned() RETURNS boolean
LANGUAGE sql STABLE AS $$
    SELECT EXISTS (
               SELECT 1
               FROM pg_stat_activity
               WHERE pid <> pg_backend_pid()
                 AND backend_xmin IS NOT NULL
                 AND (datname = current_database()
                      OR backend_type = 'walsender')
           )
        OR EXISTS (SELECT 1 FROM pg_replication_slots WHERE xmin IS NOT NULL)
        OR EXISTS (SELECT 1 FROM pg_prepared_xacts);
$$;
CREATE TABLE memtable_reclaim_t (id serial PRIMARY KEY, body text);
CREATE INDEX memtable_reclaim_idx ON memtable_reclaim_t
    USING bm25(body) WITH (text_config = 'english');
NOTICE:  BM25 index build started for relation memtable_reclaim_idx
NOTICE:  Using text search configuration: english
NOTICE:  Using index options: k1=1.20, b=0.75
NOTICE:  BM25 index build completed: 0 documents, avg_length=0.00
SELECT count(*)::int AS dead_pages_before_spill
FROM bm25_memtable_dead_pages('memtable_reclaim_idx');
 dead_pages_before_spill 
-------------------------
                       0
(1 row)

INSERT INTO memtable_reclaim_t (body)
SELECT 'reclaim ' || i || ' ' || repeat('pad ', 6)
FROM generate_series(1, 200) i;
CREATE TEMP TABLE spill_stats AS
SELECT count(*)::int AS live_pages
FROM bm25_memtable_chain('memtable_reclaim_idx');
SELECT live_pages > 1 AS chain_multi_page FROM spill_stats;
 chain_multi_page 
------------------
 t
(1 row)

SELECT bm25_spill_index('memtable_reclaim_idx') IS NOT NULL AS spill_ok;
 spill_ok 
----------
 t
(1 row)

SELECT count(*)::int AS live_chain_after_spill
FROM bm25_memtable_chain('memtable_reclaim_idx');
 live_chain_after_spill 
------------------------
                      0
(1 row)

CREATE TEMP TABLE reclaim_dead AS
SELECT count(*)::int AS dead_count
FROM bm25_memtable_dead_pages('memtable_reclaim_idx');
SELECT dead_count > 0 AS spilled_dead_pages FROM reclaim_dead;
 spilled_dead_pages 
--------------------
 t
(1 row)

SELECT
    r.dead_count = s.live_pages AS dead_matches_spilled_chain
FROM reclaim_dead r,
     spill_stats s;
 dead_matches_spilled_chain 
----------------------------
 t
(1 row)

CREATE TEMP TABLE reclaim_sizes AS
SELECT pg_relation_size('memtable_reclaim_idx'::regclass, 'main')::bigint
       AS sz_after_spill;
CREATE TEMP TABLE reclaim_blocker_state (
    pinned bool
);
INSERT INTO reclaim_blocker_state (pinned)
SELECT false;
-- Horizon: spill xact is committed (autocommit per statement).
UPDATE reclaim_blocker_state
SET pinned = pinned
    OR horizon_pinned();
VACUUM ANALYZE memtable_reclaim_t;
-- Idempotent second pass (RecordFreeIndexPage on same blocks is safe).
UPDATE reclaim_blocker_state
SET pinned = pinned
    OR horizon_pinned();
VACUUM ANALYZE memtable_reclaim_t;
SELECT count(*) >= 1 AS search_after_vacuum FROM (
    SELECT 1 FROM memtable_reclaim_t
    ORDER BY body <@> to_bm25query('reclaim', 'memtable_reclaim_idx')
    LIMIT 10
) sub;
 search_after_vacuum 
---------------------
 t
(1 row)

-- Rebuild chain without auto-spill so pages come from FSM vs extend.
SET pg_textsearch.memtable_pages_threshold = 0;
INSERT INTO memtable_reclaim_t (body)
SELECT 'reclaim2 ' || i || ' ' || repeat('pad ', 6)
FROM generate_series(1, 200) i;
SELECT count(*)::int > 0 AS chain_rebuilt
FROM bm25_memtable_chain('memtable_reclaim_idx');
 chain_rebuilt 
---------------
 t
(1 row)

-- Unblocked: VACUUM freed the DEAD pages and this rebuild reused them, so
-- the main fork does not grow and no DEAD pages remain.  Blocked: reclaim
-- is legitimately deferred, so skip the check rather than relax it.
SELECT
    CASE
        WHEN (SELECT pinned FROM reclaim_blocker_state)
            THEN true
        ELSE (pg_relation_size('memtable_reclaim_idx'::regclass, 'main')
              - (SELECT sz_after_spill FROM reclaim_sizes)) = 0
             AND (SELECT count(*)::int
                  FROM bm25_memtable_dead_pages('memtable_reclaim_idx')) = 0
    END
    AS single_cycle_growth_valid;
 single_cycle_growth_valid 
---------------------------
 t
(1 row)

-- Multi-cycle: five spill→VACUUM cycles (VACUUM cannot run inside DO).
-- With per-cycle FSM reuse, cumulative growth stays bounded by the live
-- memtable work per cycle; without reuse it would grow ~N×K pages.
CREATE TEMP TABLE multi_cycle_bounds (
    sz_start bigint,
    max_live_pages int,
    num_cycles int
);
INSERT INTO multi_cycle_bounds (sz_start, max_live_pages, num_cycles)
SELECT pg_relation_size('memtable_reclaim_idx'::regclass, 'main')::bigint,
       0,
       5;
CREATE TEMP TABLE multi_cycle_blocker_state (
    pinned bool
);
INSERT INTO multi_cycle_blocker_state (pinned)
SELECT false;
-- Cycle 1
INSERT INTO memtable_reclaim_t (body)
SELECT 'mc1 doc ' || g || ' ' || repeat('pad ', 6)
FROM generate_series(1, 200) g;
UPDATE multi_cycle_bounds SET max_live_pages = GREATEST(
    max_live_pages,
    (SELECT count(*)::int FROM bm25_memtable_chain('memtable_reclaim_idx')));
SELECT bm25_spill_index('memtable_reclaim_idx') IS NOT NULL AS mc_spill_1;
 mc_spill_1 
------------
 t
(1 row)

UPDATE multi_cycle_blocker_state
SET pinned = pinned
    OR horizon_pinned();
VACUUM ANALYZE memtable_reclaim_t;
-- Cycle 2
INSERT INTO memtable_reclaim_t (body)
SELECT 'mc2 doc ' || g || ' ' || repeat('pad ', 6)
FROM generate_series(1, 200) g;
UPDATE multi_cycle_bounds SET max_live_pages = GREATEST(
    max_live_pages,
    (SELECT count(*)::int FROM bm25_memtable_chain('memtable_reclaim_idx')));
SELECT bm25_spill_index('memtable_reclaim_idx') IS NOT NULL AS mc_spill_2;
 mc_spill_2 
------------
 t
(1 row)

UPDATE multi_cycle_blocker_state
SET pinned = pinned
    OR horizon_pinned();
VACUUM ANALYZE memtable_reclaim_t;
-- Cycle 3
INSERT INTO memtable_reclaim_t (body)
SELECT 'mc3 doc ' || g || ' ' || repeat('pad ', 6)
FROM generate_series(1, 200) g;
UPDATE multi_cycle_bounds SET max_live_pages = GREATEST(
    max_live_pages,
    (SELECT count(*)::int FROM bm25_memtable_chain('memtable_reclaim_idx')));
SELECT bm25_spill_index('memtable_reclaim_idx') IS NOT NULL AS mc_spill_3;
 mc_spill_3 
------------
 t
(1 row)

UPDATE multi_cycle_blocker_state
SET pinned = pinned
    OR horizon_pinned();
VACUUM ANALYZE memtable_reclaim_t;
-- Cycle 4
INSERT INTO memtable_reclaim_t (body)
SELECT 'mc4 doc ' || g || ' ' || repeat('pad ', 6)
FROM generate_series(1, 200) g;
UPDATE multi_cycle_bounds SET max_live_pages = GREATEST(
    max_live_pages,
    (SELECT count(*)::int FROM bm25_memtable_chain('memtable_reclaim_idx')));
SELECT bm25_spill_index('memtable_reclaim_idx') IS NOT NULL AS mc_spill_4;
 mc_spill_4 
------------
 t
(1 row)

UPDATE multi_cycle_blocker_state
SET pinned = pinned
    OR horizon_pinned();
VACUUM ANALYZE memtable_reclaim_t;
-- Cycle 5
INSERT INTO memtable_reclaim_t (body)
SELECT 'mc5 doc ' || g || ' ' || repeat('pad ', 6)
FROM generate_series(1, 200) g;
UPDATE multi_cycle_bounds SET max_live_pages = GREATEST(
    max_live_pages,
    (SELECT count(*)::int FROM bm25_memtable_chain('memtable_reclaim_idx')));
SELECT bm25_spill_index('memtable_reclaim_idx') IS NOT NULL AS mc_spill_5;
 mc_spill_5 
------------
 t
(1 row)

UPDATE multi_cycle_blocker_state
SET pinned = pinned
    OR horizon_pinned();
VACUUM ANALYZE memtable_reclaim_t;
SELECT max_live_pages > 1 AS multi_cycle_chain_multi_page
FROM multi_cycle_bounds;
 multi_cycle_chain_multi_page 
------------------------------
 t
(1 row)

-- Cumulative growth must stay within one live chain per cycle
-- (num_cycles * max_live_pages).  As above, skip when a blocker held the
-- horizon.
SELECT
    CASE
        WHEN (SELECT pinned FROM multi_cycle_blocker_state)
            THEN true
        ELSE (pg_relation_size('memtable_reclaim_idx'::regclass, 'main')
              - (SELECT sz_start FROM multi_cycle_bounds))
             <= (SELECT num_cycles * max_live_pages FROM multi_cycle_bounds)
                * current_setting('block_size')::bigint
    END
    AS multi_cycle_growth_valid;
 multi_cycle_growth_valid 
--------------------------
 t
(1 row)

DROP FUNCTION horizon_pinned();
DROP TABLE memtable_reclaim_t;
DROP EXTENSION pg_textsearch CASCADE;
