-- Test case: quoted_identifiers
-- Tests that BM25 indexes work correctly with quoted (case-sensitive)
-- identifiers for both index names and schema names.
-- Regression test for https://github.com/timescale/pg_textsearch/issues/285
CREATE EXTENSION IF NOT EXISTS pg_textsearch;
INFO:  pg_textsearch v1.0.0
-- Test 1: Uppercase index name (the reported bug)
CREATE TABLE qi_test1 (
    id SERIAL PRIMARY KEY,
    content TEXT
);
CREATE INDEX "IX_qi_test1_content" ON qi_test1 USING bm25(content)
  WITH (text_config='english');
NOTICE:  BM25 index build started for relation IX_qi_test1_content
NOTICE:  Using text search configuration: english
NOTICE:  Using index options: k1=1.20, b=0.75
NOTICE:  BM25 index build completed: 0 documents, avg_length=0.00
INSERT INTO qi_test1 (content) VALUES ('lorem ipsum dolor sit amet');
INSERT INTO qi_test1 (content) VALUES ('quick brown fox jumps');
INSERT INTO qi_test1 (content) VALUES ('lorem ipsum again');
SELECT id, content FROM qi_test1 ORDER BY id;
 id |          content           
----+----------------------------
  1 | lorem ipsum dolor sit amet
  2 | quick brown fox jumps
  3 | lorem ipsum again
(3 rows)

-- Test 2: Query with uppercase index name
SET enable_seqscan = off;
SELECT id, content,
       ROUND((content <@> to_bm25query('lorem', 'IX_qi_test1_content'))::numeric, 4) AS score
FROM qi_test1
WHERE content <@> to_bm25query('lorem', 'IX_qi_test1_content') < 0
ORDER BY content <@> to_bm25query('lorem', 'IX_qi_test1_content'), id;
 id |          content           |  score  
----+----------------------------+---------
  3 | lorem ipsum again          | -0.5774
  1 | lorem ipsum dolor sit amet | -0.4091
(2 rows)

-- Test 3: Uppercase schema name with lowercase index
CREATE SCHEMA "MySchema";
CREATE TABLE "MySchema".docs (
    id SERIAL PRIMARY KEY,
    content TEXT
);
CREATE INDEX idx_myschema_docs ON "MySchema".docs USING bm25(content)
  WITH (text_config='english');
NOTICE:  BM25 index build started for relation idx_myschema_docs
NOTICE:  Using text search configuration: english
NOTICE:  Using index options: k1=1.20, b=0.75
NOTICE:  BM25 index build completed: 0 documents, avg_length=0.00
INSERT INTO "MySchema".docs (content) VALUES ('hello world');
INSERT INTO "MySchema".docs (content) VALUES ('goodbye world');
SELECT id, content FROM "MySchema".docs ORDER BY id;
 id |    content    
----+---------------
  1 | hello world
  2 | goodbye world
(2 rows)

-- Query using schema-qualified index
SELECT id, content,
       ROUND((content <@> to_bm25query('hello',
         '"MySchema".idx_myschema_docs'))::numeric, 4) AS score
FROM "MySchema".docs
WHERE content <@> to_bm25query('hello',
  '"MySchema".idx_myschema_docs') < 0
ORDER BY content <@> to_bm25query('hello',
  '"MySchema".idx_myschema_docs'), id;
 id |   content   |  score  
----+-------------+---------
  1 | hello world | -0.6931
(1 row)

-- Test 4: Both uppercase schema and uppercase index
CREATE TABLE "MySchema".docs2 (
    id SERIAL PRIMARY KEY,
    content TEXT
);
CREATE INDEX "IX_MyDocs" ON "MySchema".docs2 USING bm25(content)
  WITH (text_config='english');
NOTICE:  BM25 index build started for relation IX_MyDocs
NOTICE:  Using text search configuration: english
NOTICE:  Using index options: k1=1.20, b=0.75
NOTICE:  BM25 index build completed: 0 documents, avg_length=0.00
INSERT INTO "MySchema".docs2 (content) VALUES ('alpha beta gamma');
INSERT INTO "MySchema".docs2 (content) VALUES ('delta epsilon');
SELECT id, content FROM "MySchema".docs2 ORDER BY id;
 id |     content      
----+------------------
  1 | alpha beta gamma
  2 | delta epsilon
(2 rows)

-- Query using both-uppercase schema-qualified index
SELECT id, content,
       ROUND((content <@> to_bm25query('alpha',
         '"MySchema"."IX_MyDocs"'))::numeric, 4) AS score
FROM "MySchema".docs2
WHERE content <@> to_bm25query('alpha',
  '"MySchema"."IX_MyDocs"') < 0
ORDER BY content <@> to_bm25query('alpha',
  '"MySchema"."IX_MyDocs"'), id;
 id |     content      |  score  
----+------------------+---------
  1 | alpha beta gamma | -0.6407
(1 row)

-- Test 5: UPDATE with uppercase index name
UPDATE qi_test1 SET content = 'updated lorem ipsum' WHERE id = 1;
SELECT id, content FROM qi_test1 ORDER BY id;
 id |        content        
----+-----------------------
  1 | updated lorem ipsum
  2 | quick brown fox jumps
  3 | lorem ipsum again
(3 rows)

-- Test 6: DELETE with uppercase index name
DELETE FROM qi_test1 WHERE id = 2;
SELECT id, content FROM qi_test1 ORDER BY id;
 id |       content       
----+---------------------
  1 | updated lorem ipsum
  3 | lorem ipsum again
(2 rows)

-- Test 7: VACUUM with uppercase index name
VACUUM qi_test1;
SELECT id, content FROM qi_test1 ORDER BY id;
 id |       content       
----+---------------------
  1 | updated lorem ipsum
  3 | lorem ipsum again
(2 rows)

-- Test 8: bm25_dump_index with schema-qualified uppercase index
SELECT bm25_dump_index('"MySchema"."IX_MyDocs"')::text
  ~ 'Tapir Index Debug' AS dump_works;
 dump_works 
------------
 t
(1 row)

-- Test 9: bm25_summarize_index with schema-qualified uppercase index
SELECT bm25_summarize_index('"MySchema"."IX_MyDocs"')::text
  ~ 'total_docs: 2' AS summarize_works;
 summarize_works 
-----------------
 t
(1 row)

-- Cleanup
DROP TABLE qi_test1 CASCADE;
DROP TABLE "MySchema".docs CASCADE;
DROP TABLE "MySchema".docs2 CASCADE;
DROP SCHEMA "MySchema" CASCADE;
DROP EXTENSION pg_textsearch CASCADE;
