-- Test VACUUM behavior with BM25 indexes
-- Ensure extension is loaded
CREATE EXTENSION IF NOT EXISTS pg_textsearch;
INFO:  pg_textsearch v0.4.0-dev installed
-- Create test table
CREATE TABLE vacuum_test (
    id SERIAL PRIMARY KEY,
    content TEXT
);
-- Insert test documents
INSERT INTO vacuum_test (content) VALUES
    ('document one with test'),
    ('document two without keyword'),
    ('document three with test word'),
    ('document four plain text'),
    ('document five has test');
-- Create index
CREATE INDEX vacuum_idx ON vacuum_test
USING bm25 (content)
WITH (text_config = 'english');
NOTICE:  BM25 index build started for relation vacuum_idx
NOTICE:  Using text search configuration: english
NOTICE:  Using index options: k1=1.20, b=0.75
NOTICE:  BM25 index build completed: 5 documents, avg_length=3.60, text_config='english' (k1=1.20, b=0.75)
-- Check index statistics before deletions
-- Extract just the total_docs line from debug output
SELECT split_part(
    split_part(bm25_dump_index('vacuum_idx')::text, 'total_docs: ', 2),
    E'\n', 1
) AS total_docs_before;
 total_docs_before 
-------------------
 5
(1 row)

-- Delete some documents
DELETE FROM vacuum_test WHERE id IN (
    SELECT id FROM vacuum_test WHERE content LIKE '%test%' LIMIT 2
);
-- Check that index statistics haven't changed yet (deletions not processed)
SELECT split_part(
    split_part(bm25_dump_index('vacuum_idx')::text, 'total_docs: ', 2),
    E'\n', 1
) AS total_docs_after_delete;
 total_docs_after_delete 
-------------------------
 5
(1 row)

-- Run VACUUM to clean up deleted tuples
VACUUM vacuum_test;
-- Check index statistics after VACUUM
-- Note: Our current implementation may not update stats until rebuild
SELECT split_part(
    split_part(bm25_dump_index('vacuum_idx')::text, 'total_docs: ', 2),
    E'\n', 1
) AS total_docs_after_vacuum;
 total_docs_after_vacuum 
-------------------------
 5
(1 row)

-- Search should still work correctly after VACUUM
-- Note: WHERE with score comparison requires explicit index reference
SELECT id, substring(content, 1, 30) as content_preview
FROM vacuum_test
WHERE content <@> to_bm25query('test', 'vacuum_idx') < -0.001
ORDER BY content <@> to_bm25query('test', 'vacuum_idx')
LIMIT 5;
 id |    content_preview     
----+------------------------
  5 | document five has test
(1 row)

-- Test VACUUM FULL (more aggressive cleanup)
-- VACUUM FULL rebuilds indexes
DELETE FROM vacuum_test WHERE content NOT LIKE '%test%';
-- We use \set VERBOSITY terse to avoid OID-specific error messages
\set VERBOSITY terse
VACUUM FULL vacuum_test;
NOTICE:  BM25 index build started for relation vacuum_idx
NOTICE:  Using text search configuration: english
NOTICE:  Using index options: k1=1.20, b=0.75
NOTICE:  BM25 index build completed: 1 documents, avg_length=3.00, text_config='english' (k1=1.20, b=0.75)
\set VERBOSITY default
-- Check statistics after VACUUM FULL
SELECT split_part(
    split_part(bm25_dump_index('vacuum_idx')::text, 'total_docs: ', 2),
    E'\n', 1
) AS total_docs_after_vacuum_full;
 total_docs_after_vacuum_full 
------------------------------
 1
(1 row)

-- Verify search still works
SELECT id, substring(content, 1, 30) as content_preview
FROM vacuum_test
WHERE content <@> to_bm25query('test', 'vacuum_idx') < -0.001
ORDER BY content <@> to_bm25query('test', 'vacuum_idx');
 id |    content_preview     
----+------------------------
  5 | document five has test
(1 row)

-- Clean up
DROP TABLE vacuum_test;
DROP EXTENSION pg_textsearch;
