-- Extended vacuum tests for BM25 indexes
-- Exercises vacuum paths with segments, bulk deletes, and empty indexes
CREATE EXTENSION IF NOT EXISTS pg_textsearch;
WARNING:  pg_textsearch v1.0.0-dev is a prerelease. Do not use in production.
-- =============================================================================
-- Test 1: Vacuum with segments present
-- =============================================================================
CREATE TABLE vacuum_seg_test (id serial PRIMARY KEY, content text);
CREATE INDEX vacuum_seg_idx ON vacuum_seg_test USING bm25(content)
    WITH (text_config='english');
NOTICE:  BM25 index build started for relation vacuum_seg_idx
NOTICE:  Using text search configuration: english
NOTICE:  Using index options: k1=1.20, b=0.75
NOTICE:  BM25 index build completed: 0 documents, avg_length=0.00
-- Insert data and force segment creation
INSERT INTO vacuum_seg_test (content)
SELECT 'vacuum segment test document number ' || i
FROM generate_series(1, 200) AS i;
SELECT bm25_spill_index('vacuum_seg_idx');
 bm25_spill_index 
------------------
                2
(1 row)

-- Delete half the documents
DELETE FROM vacuum_seg_test WHERE id <= 100;
-- VACUUM with segments on disk
VACUUM vacuum_seg_test;
-- Verify search still works after vacuum with segments
SELECT count(*) FROM vacuum_seg_test
WHERE content <@> to_bm25query('vacuum', 'vacuum_seg_idx') < 0;
 count 
-------
   100
(1 row)

-- =============================================================================
-- Test 2: VACUUM FULL with segments (forces index rebuild)
-- =============================================================================
\set VERBOSITY terse
VACUUM FULL vacuum_seg_test;
NOTICE:  BM25 index build started for relation vacuum_seg_idx
NOTICE:  Using text search configuration: english
NOTICE:  Using index options: k1=1.20, b=0.75
NOTICE:  BM25 index build completed: 100 documents, avg_length=6.00
\set VERBOSITY default
-- Verify search works after VACUUM FULL rebuild
SELECT count(*) FROM vacuum_seg_test
WHERE content <@> to_bm25query('vacuum', 'vacuum_seg_idx') < 0;
 count 
-------
   100
(1 row)

DROP TABLE vacuum_seg_test;
-- =============================================================================
-- Test 3: Vacuum on empty index
-- =============================================================================
CREATE TABLE vacuum_empty_test (id serial PRIMARY KEY, content text);
CREATE INDEX vacuum_empty_idx ON vacuum_empty_test USING bm25(content)
    WITH (text_config='english');
NOTICE:  BM25 index build started for relation vacuum_empty_idx
NOTICE:  Using text search configuration: english
NOTICE:  Using index options: k1=1.20, b=0.75
NOTICE:  BM25 index build completed: 0 documents, avg_length=0.00
-- Vacuum empty index (should be a no-op)
VACUUM vacuum_empty_test;
-- Insert one doc, delete it, vacuum
INSERT INTO vacuum_empty_test (content) VALUES ('single document');
DELETE FROM vacuum_empty_test;
VACUUM vacuum_empty_test;
DROP TABLE vacuum_empty_test;
-- =============================================================================
-- Test 4: Bulk delete from memtable (exercises tp_bulkdelete_memtable_ctids)
-- =============================================================================
CREATE TABLE vacuum_bulk_test (id serial PRIMARY KEY, content text);
CREATE INDEX vacuum_bulk_idx ON vacuum_bulk_test USING bm25(content)
    WITH (text_config='english');
NOTICE:  BM25 index build started for relation vacuum_bulk_idx
NOTICE:  Using text search configuration: english
NOTICE:  Using index options: k1=1.20, b=0.75
NOTICE:  BM25 index build completed: 0 documents, avg_length=0.00
-- Insert docs (stays in memtable)
INSERT INTO vacuum_bulk_test (content)
SELECT 'bulk delete test term' || (i % 10) || ' document ' || i
FROM generate_series(1, 50) AS i;
-- Delete most of them
DELETE FROM vacuum_bulk_test WHERE id > 5;
-- Vacuum to clean up memtable entries
VACUUM vacuum_bulk_test;
-- Verify remaining docs are searchable
SELECT count(*) FROM vacuum_bulk_test
WHERE content <@> to_bm25query('bulk', 'vacuum_bulk_idx') < 0;
 count 
-------
     5
(1 row)

DROP TABLE vacuum_bulk_test;
-- =============================================================================
-- Test 5: REINDEX with unflushed memtable data
--
-- Verifies that REINDEX correctly rebuilds from the heap even when
-- the memtable has unflushed entries from recent INSERTs.
-- =============================================================================
CREATE TABLE reindex_memtable_test (
    id serial PRIMARY KEY,
    content text
);
CREATE INDEX reindex_memtable_idx
    ON reindex_memtable_test USING bm25(content)
    WITH (text_config='english');
NOTICE:  BM25 index build started for relation reindex_memtable_idx
NOTICE:  Using text search configuration: english
NOTICE:  Using index options: k1=1.20, b=0.75
NOTICE:  BM25 index build completed: 0 documents, avg_length=0.00
-- Phase 1: Initial data via CREATE INDEX (already built above)
INSERT INTO reindex_memtable_test (content)
SELECT 'original document about databases number ' || i
FROM generate_series(1, 50) AS i;
-- Force a spill so we have segments on disk
SELECT bm25_spill_index('reindex_memtable_idx');
 bm25_spill_index 
------------------
                2
(1 row)

-- Verify baseline: all 50 docs are searchable
SELECT count(*) AS pre_reindex_count FROM reindex_memtable_test
WHERE content <@> to_bm25query('databases', 'reindex_memtable_idx') < 0;
 pre_reindex_count 
-------------------
                50
(1 row)

-- Phase 2: Insert more rows that stay in memtable (unflushed)
INSERT INTO reindex_memtable_test (content)
SELECT 'additional document about databases number ' || i
FROM generate_series(51, 75) AS i;
-- Verify memtable scan finds all 75 docs
SELECT count(*) AS with_memtable_count FROM reindex_memtable_test
WHERE content <@> to_bm25query('databases', 'reindex_memtable_idx') < 0;
 with_memtable_count 
---------------------
                  75
(1 row)

-- Phase 3: REINDEX discards memtable, rebuilds from heap
\set VERBOSITY terse
REINDEX INDEX reindex_memtable_idx;
NOTICE:  BM25 index build started for relation reindex_memtable_idx
NOTICE:  Using text search configuration: english
NOTICE:  Using index options: k1=1.20, b=0.75
NOTICE:  BM25 index build completed: 75 documents, avg_length=5.00
\set VERBOSITY default
-- All 75 docs must still be found (rebuilt from heap, not memtable)
SELECT count(*) AS post_reindex_count FROM reindex_memtable_test
WHERE content <@> to_bm25query('databases', 'reindex_memtable_idx') < 0;
 post_reindex_count 
--------------------
                 75
(1 row)

-- Phase 4: Verify INSERTs still work after REINDEX
INSERT INTO reindex_memtable_test (content)
VALUES ('final document about databases after reindex');
SELECT count(*) AS final_count FROM reindex_memtable_test
WHERE content <@> to_bm25query('databases', 'reindex_memtable_idx') < 0;
 final_count 
-------------
          76
(1 row)

DROP TABLE reindex_memtable_test;
-- =============================================================================
-- Test 6: Bulk load with unflushed memtable data
--
-- Verifies that a large INSERT into an already-indexed table correctly
-- triggers auto-spills from the memtable while preserving earlier
-- unflushed memtable entries.  Uses a low spill threshold so the test
-- triggers multiple spills without needing millions of rows.
-- =============================================================================
-- Lower spill threshold BEFORE creating the table so it applies to inserts
SET pg_textsearch.memtable_spill_threshold = 500;
CREATE TABLE bulk_memtable_test (
    id serial PRIMARY KEY,
    content text
);
CREATE INDEX bulk_memtable_idx
    ON bulk_memtable_test USING bm25(content)
    WITH (text_config='english');
NOTICE:  BM25 index build started for relation bulk_memtable_idx
NOTICE:  Using text search configuration: english
NOTICE:  Using index options: k1=1.20, b=0.75
NOTICE:  BM25 index build completed: 0 documents, avg_length=0.00
-- Phase 1: Small insert that stays in memtable
INSERT INTO bulk_memtable_test (content)
SELECT 'initial document about networking topic ' || i
FROM generate_series(1, 10) AS i;
SELECT count(*) AS initial_count FROM bulk_memtable_test
WHERE content <@> to_bm25query('networking', 'bulk_memtable_idx') < 0;
 initial_count 
---------------
            10
(1 row)

-- Phase 2: Bulk insert triggers multiple auto-spills
INSERT INTO bulk_memtable_test (content)
SELECT 'bulk loaded document about networking and databases number ' || i
FROM generate_series(11, 5000) AS i;
-- All 5000 docs must be found (initial memtable + spilled segments + tail)
SELECT count(*) AS after_bulk_count FROM bulk_memtable_test
WHERE content <@> to_bm25query('networking', 'bulk_memtable_idx') < 0;
 after_bulk_count 
------------------
             5000
(1 row)

-- Verify segments were created by the auto-spill
SELECT bm25_summarize_index('bulk_memtable_idx') ~ 'Total:.*segments'
    AS has_segments;
 has_segments 
--------------
 t
(1 row)

-- Phase 3: More inserts after bulk load still work
INSERT INTO bulk_memtable_test (content)
VALUES ('final document about networking after bulk load');
SELECT count(*) AS final_count FROM bulk_memtable_test
WHERE content <@> to_bm25query('networking', 'bulk_memtable_idx') < 0;
 final_count 
-------------
        5001
(1 row)

RESET pg_textsearch.memtable_spill_threshold;
DROP TABLE bulk_memtable_test;
-- Clean up
DROP EXTENSION pg_textsearch CASCADE;
