-- Extended vacuum tests for BM25 indexes
-- Exercises vacuum paths with segments, bulk deletes, and empty indexes
CREATE EXTENSION IF NOT EXISTS pg_textsearch;
INFO:  pg_textsearch v1.1.0-dev
-- =============================================================================
-- Test 1: Vacuum with segments present
-- =============================================================================
CREATE TABLE vacuum_seg_test (id serial PRIMARY KEY, content text);
CREATE INDEX vacuum_seg_idx ON vacuum_seg_test USING bm25(content)
    WITH (text_config='english');
NOTICE:  BM25 index build started for relation vacuum_seg_idx
NOTICE:  Using text search configuration: english
NOTICE:  Using index options: k1=1.20, b=0.75
NOTICE:  BM25 index build completed: 0 documents, avg_length=0.00
-- Insert data and force segment creation
INSERT INTO vacuum_seg_test (content)
SELECT 'vacuum segment test document number ' || i
FROM generate_series(1, 200) AS i;
SELECT bm25_spill_index('vacuum_seg_idx');
 bm25_spill_index 
------------------
                2
(1 row)

-- Delete half the documents
DELETE FROM vacuum_seg_test WHERE id <= 100;
-- VACUUM with segments on disk
VACUUM vacuum_seg_test;
-- Verify search still works after vacuum with segments
SELECT count(*) FROM (
    SELECT 1 FROM vacuum_seg_test
    ORDER BY content <@> to_bm25query('vacuum', 'vacuum_seg_idx')
) sub;
 count 
-------
   100
(1 row)

-- =============================================================================
-- Test 2: VACUUM FULL with segments (forces index rebuild)
-- =============================================================================
\set VERBOSITY terse
VACUUM FULL vacuum_seg_test;
NOTICE:  BM25 index build started for relation vacuum_seg_idx
NOTICE:  Using text search configuration: english
NOTICE:  Using index options: k1=1.20, b=0.75
NOTICE:  BM25 index build completed: 100 documents, avg_length=6.00
\set VERBOSITY default
-- Verify search works after VACUUM FULL rebuild
SELECT count(*) FROM (
    SELECT 1 FROM vacuum_seg_test
    ORDER BY content <@> to_bm25query('vacuum', 'vacuum_seg_idx')
) sub;
 count 
-------
   100
(1 row)

DROP TABLE vacuum_seg_test;
-- =============================================================================
-- Test 3: Vacuum on empty index
-- =============================================================================
CREATE TABLE vacuum_empty_test (id serial PRIMARY KEY, content text);
CREATE INDEX vacuum_empty_idx ON vacuum_empty_test USING bm25(content)
    WITH (text_config='english');
NOTICE:  BM25 index build started for relation vacuum_empty_idx
NOTICE:  Using text search configuration: english
NOTICE:  Using index options: k1=1.20, b=0.75
NOTICE:  BM25 index build completed: 0 documents, avg_length=0.00
-- Vacuum empty index (should be a no-op)
VACUUM vacuum_empty_test;
-- Insert one doc, delete it, vacuum
INSERT INTO vacuum_empty_test (content) VALUES ('single document');
DELETE FROM vacuum_empty_test;
VACUUM vacuum_empty_test;
DROP TABLE vacuum_empty_test;
-- =============================================================================
-- Test 4: Bulk delete from memtable (exercises tp_bulkdelete_memtable_ctids)
-- =============================================================================
CREATE TABLE vacuum_bulk_test (id serial PRIMARY KEY, content text);
CREATE INDEX vacuum_bulk_idx ON vacuum_bulk_test USING bm25(content)
    WITH (text_config='english');
NOTICE:  BM25 index build started for relation vacuum_bulk_idx
NOTICE:  Using text search configuration: english
NOTICE:  Using index options: k1=1.20, b=0.75
NOTICE:  BM25 index build completed: 0 documents, avg_length=0.00
-- Insert docs (stays in memtable)
INSERT INTO vacuum_bulk_test (content)
SELECT 'bulk delete test term' || (i % 10) || ' document ' || i
FROM generate_series(1, 50) AS i;
-- Delete most of them
DELETE FROM vacuum_bulk_test WHERE id > 5;
-- Vacuum to clean up memtable entries
VACUUM vacuum_bulk_test;
-- Verify remaining docs are searchable
SELECT count(*) FROM (
    SELECT 1 FROM vacuum_bulk_test
    ORDER BY content <@> to_bm25query('bulk', 'vacuum_bulk_idx')
) sub;
 count 
-------
     5
(1 row)

DROP TABLE vacuum_bulk_test;
-- =============================================================================
-- Test 5: REINDEX with unflushed memtable data
--
-- Verifies that REINDEX correctly rebuilds from the heap even when
-- the memtable has unflushed entries from recent INSERTs.
-- =============================================================================
CREATE TABLE reindex_memtable_test (
    id serial PRIMARY KEY,
    content text
);
CREATE INDEX reindex_memtable_idx
    ON reindex_memtable_test USING bm25(content)
    WITH (text_config='english');
NOTICE:  BM25 index build started for relation reindex_memtable_idx
NOTICE:  Using text search configuration: english
NOTICE:  Using index options: k1=1.20, b=0.75
NOTICE:  BM25 index build completed: 0 documents, avg_length=0.00
-- Phase 1: Initial data via CREATE INDEX (already built above)
INSERT INTO reindex_memtable_test (content)
SELECT 'original document about databases number ' || i
FROM generate_series(1, 50) AS i;
-- Force a spill so we have segments on disk
SELECT bm25_spill_index('reindex_memtable_idx');
 bm25_spill_index 
------------------
                2
(1 row)

-- Verify baseline: all 50 docs are searchable
SELECT count(*) AS pre_reindex_count FROM (
    SELECT 1 FROM reindex_memtable_test
    ORDER BY content <@> to_bm25query('databases', 'reindex_memtable_idx')
) sub;
 pre_reindex_count 
-------------------
                50
(1 row)

-- Phase 2: Insert more rows that stay in memtable (unflushed)
INSERT INTO reindex_memtable_test (content)
SELECT 'additional document about databases number ' || i
FROM generate_series(51, 75) AS i;
-- Verify memtable scan finds all 75 docs
SELECT count(*) AS with_memtable_count FROM (
    SELECT 1 FROM reindex_memtable_test
    ORDER BY content <@> to_bm25query('databases', 'reindex_memtable_idx')
) sub;
 with_memtable_count 
---------------------
                  75
(1 row)

-- Phase 3: REINDEX discards memtable, rebuilds from heap
\set VERBOSITY terse
REINDEX INDEX reindex_memtable_idx;
NOTICE:  BM25 index build started for relation reindex_memtable_idx
NOTICE:  Using text search configuration: english
NOTICE:  Using index options: k1=1.20, b=0.75
NOTICE:  BM25 index build completed: 75 documents, avg_length=5.00
\set VERBOSITY default
-- All 75 docs must still be found (rebuilt from heap, not memtable)
SELECT count(*) AS post_reindex_count FROM (
    SELECT 1 FROM reindex_memtable_test
    ORDER BY content <@> to_bm25query('databases', 'reindex_memtable_idx')
) sub;
 post_reindex_count 
--------------------
                 75
(1 row)

-- Phase 4: Verify INSERTs still work after REINDEX
INSERT INTO reindex_memtable_test (content)
VALUES ('final document about databases after reindex');
SELECT count(*) AS final_count FROM (
    SELECT 1 FROM reindex_memtable_test
    ORDER BY content <@> to_bm25query('databases', 'reindex_memtable_idx')
) sub;
 final_count 
-------------
          76
(1 row)

DROP TABLE reindex_memtable_test;
-- =============================================================================
-- Test 6: Bulk load with unflushed memtable data
--
-- Verifies that a large INSERT into an already-indexed table correctly
-- triggers auto-spills from the memtable while preserving earlier
-- unflushed memtable entries.  Uses a low spill threshold so the test
-- triggers multiple spills without needing millions of rows.
-- =============================================================================
-- Lower spill threshold BEFORE creating the table so it applies to inserts
SET pg_textsearch.memtable_spill_threshold = 500;
CREATE TABLE bulk_memtable_test (
    id serial PRIMARY KEY,
    content text
);
CREATE INDEX bulk_memtable_idx
    ON bulk_memtable_test USING bm25(content)
    WITH (text_config='english');
NOTICE:  BM25 index build started for relation bulk_memtable_idx
NOTICE:  Using text search configuration: english
NOTICE:  Using index options: k1=1.20, b=0.75
NOTICE:  BM25 index build completed: 0 documents, avg_length=0.00
-- Phase 1: Small insert that stays in memtable
INSERT INTO bulk_memtable_test (content)
SELECT 'initial document about networking topic ' || i
FROM generate_series(1, 10) AS i;
SELECT count(*) AS initial_count FROM (
    SELECT 1 FROM bulk_memtable_test
    ORDER BY content <@> to_bm25query('networking', 'bulk_memtable_idx')
) sub;
 initial_count 
---------------
            10
(1 row)

-- Phase 2: Bulk insert triggers multiple auto-spills
INSERT INTO bulk_memtable_test (content)
SELECT 'bulk loaded document about networking and databases number ' || i
FROM generate_series(11, 5000) AS i;
-- All 5000 docs must be found (initial memtable + spilled segments + tail)
SELECT count(*) AS after_bulk_count FROM (
    SELECT 1 FROM bulk_memtable_test
    ORDER BY content <@> to_bm25query('networking', 'bulk_memtable_idx')
) sub;
 after_bulk_count 
------------------
             5000
(1 row)

-- Verify segments were created by the auto-spill
SELECT bm25_summarize_index('bulk_memtable_idx') ~ 'Total:.*segments'
    AS has_segments;
 has_segments 
--------------
 t
(1 row)

-- Phase 3: More inserts after bulk load still work
INSERT INTO bulk_memtable_test (content)
VALUES ('final document about networking after bulk load');
SELECT count(*) AS final_count FROM (
    SELECT 1 FROM bulk_memtable_test
    ORDER BY content <@> to_bm25query('networking', 'bulk_memtable_idx')
) sub;
 final_count 
-------------
        5001
(1 row)

RESET pg_textsearch.memtable_spill_threshold;
DROP TABLE bulk_memtable_test;
-- =============================================================================
-- Test 7: VACUUM spills un-spilled memtable on insert-only tables (issue #333)
--
-- On insert-only workloads ambulkdelete is skipped (no dead tuples), so the
-- memtable spill that used to live only there never ran.  The docid-page
-- chain then grew unbounded and the first query after a server restart had
-- to re-tokenize every referenced heap tuple.  This test exercises the
-- amvacuumcleanup path that now performs the spill.
-- =============================================================================
CREATE TABLE vacuum_insert_only_test (
    id serial PRIMARY KEY,
    content text
);
CREATE INDEX vacuum_insert_only_idx
    ON vacuum_insert_only_test USING bm25(content)
    WITH (text_config='english');
NOTICE:  BM25 index build started for relation vacuum_insert_only_idx
NOTICE:  Using text search configuration: english
NOTICE:  Using index options: k1=1.20, b=0.75
NOTICE:  BM25 index build completed: 0 documents, avg_length=0.00
-- Populate the docid chain above TP_MIN_SPILL_POSTINGS (1000) but
-- below pg_textsearch.bulk_load_threshold so the spill only happens
-- via amvacuumcleanup.  2000 docs * ~4 terms each ≈ 8000 postings.
INSERT INTO vacuum_insert_only_test (content)
SELECT 'insert only document number ' || i
FROM generate_series(1, 2000) AS i;
-- Chain should be populated before VACUUM.
SELECT bm25_summarize_index('vacuum_insert_only_idx')
        ~ E'docids: 2000\n'
    AS chain_populated_before_vacuum;
 chain_populated_before_vacuum 
-------------------------------
 t
(1 row)

-- No dead tuples here, so ambulkdelete is not invoked; only
-- amvacuumcleanup runs.  It must still drain the docid chain.
VACUUM vacuum_insert_only_test;
-- Chain must be fully drained and the memtable contents spilled to a segment.
SELECT bm25_summarize_index('vacuum_insert_only_idx')
        ~ E'docids: 0\n'
    AS chain_empty_after_vacuum;
 chain_empty_after_vacuum 
--------------------------
 t
(1 row)

-- Search still finds all 2000 docs.
SELECT count(*) AS post_vacuum_count FROM (
    SELECT 1 FROM vacuum_insert_only_test
    ORDER BY content
        <@> to_bm25query('document', 'vacuum_insert_only_idx')
) sub;
 post_vacuum_count 
-------------------
              2000
(1 row)

DROP TABLE vacuum_insert_only_test;
-- =============================================================================
-- Test 8: tiny memtable stays un-spilled across VACUUM (issue #333 guard)
-- =============================================================================
--
-- Below TP_MIN_SPILL_POSTINGS the VACUUM-cleanup spill is a no-op,
-- because writing a runt L0 segment would cost more in subsequent
-- compaction than chain replay saves.
CREATE TABLE vacuum_tiny_test (id serial PRIMARY KEY, content text);
CREATE INDEX vacuum_tiny_idx
    ON vacuum_tiny_test USING bm25(content)
    WITH (text_config='english');
NOTICE:  BM25 index build started for relation vacuum_tiny_idx
NOTICE:  Using text search configuration: english
NOTICE:  Using index options: k1=1.20, b=0.75
NOTICE:  BM25 index build completed: 0 documents, avg_length=0.00
-- ~50 docs * ~4 terms = ~200 postings, well below the guard.
INSERT INTO vacuum_tiny_test (content)
SELECT 'tiny doc ' || i FROM generate_series(1, 50) AS i;
VACUUM vacuum_tiny_test;
-- Chain is still present; no runt L0 segment was produced.
SELECT bm25_summarize_index('vacuum_tiny_idx')
        ~ E'docids: 50\n'
    AS chain_preserved_after_vacuum;
 chain_preserved_after_vacuum 
------------------------------
 t
(1 row)

DROP TABLE vacuum_tiny_test;
-- =============================================================================
-- Test 9: dropping a memtable-spilled L0 segment keeps total_len sane
-- =============================================================================
--
-- Regression test.  tp_write_segment used to leave header.total_tokens
-- at the cumulative shared-atomic value instead of the per-segment
-- sum.  When VACUUM later dropped that segment (all docs dead) the
-- inflated header.total_tokens was subtracted from metap->total_len
-- and the atomic, clamping them to 0 (or wrapping the atomic) and
-- breaking avgdl in BM25 scoring for the surviving docs.
--
-- We populate two L0 segments with distinct id ranges, delete every
-- row that landed in the second one, and then run VACUUM.  Afterwards
-- a search over the surviving corpus must return real matches.
CREATE TABLE l0_total_len_test (id serial PRIMARY KEY, content text);
CREATE INDEX l0_total_len_idx ON l0_total_len_test USING bm25(content)
    WITH (text_config='english');
NOTICE:  BM25 index build started for relation l0_total_len_idx
NOTICE:  Using text search configuration: english
NOTICE:  Using index options: k1=1.20, b=0.75
NOTICE:  BM25 index build completed: 0 documents, avg_length=0.00
-- Segment 1: ids 1..50 (the survivors).
INSERT INTO l0_total_len_test (content)
SELECT 'alpha common term doc ' || i FROM generate_series(1, 50) AS i;
SELECT bm25_spill_index('l0_total_len_idx');
 bm25_spill_index 
------------------
                2
(1 row)

-- Segment 2: ids 51..100 (to be fully deleted).
INSERT INTO l0_total_len_test (content)
SELECT 'beta common term doc ' || i FROM generate_series(51, 100) AS i;
SELECT bm25_spill_index('l0_total_len_idx');
 bm25_spill_index 
------------------
                5
(1 row)

-- Wipe every row that went into segment 2, then VACUUM to drop it.
DELETE FROM l0_total_len_test WHERE id > 50;
VACUUM l0_total_len_test;
-- total_len must reflect only the surviving segment's tokens.  The
-- pre-fix path inflated header.total_tokens to the cumulative atomic
-- so the subtraction clamped total_len to 0.  A healthy avg_doc_len
-- is the sharpest regression signal.
SELECT bm25_summarize_index('l0_total_len_idx') ~ E'total_len: 250\n'
    AS total_len_matches_survivors,
       bm25_summarize_index('l0_total_len_idx') ~ E'avg_doc_len: 5\\.00\n'
    AS avgdl_sane;
 total_len_matches_survivors | avgdl_sane 
-----------------------------+------------
 t                           | t
(1 row)

DROP TABLE l0_total_len_test;
-- =============================================================================
-- Test 10: merged segments carry raw total_tokens (long docs + VACUUM)
-- =============================================================================
--
-- Regression test.  merge.c used to recompute header.total_tokens as
-- Σ decode_fieldnorm(fieldnorms[d]), which is exponentially quantized
-- for doc_length > 39 (e.g. 100→96).  metap->total_len stayed raw
-- (set from the atomic), so the drift was latent until a VACUUM drop
-- of the merged segment fed the quantized header value back into
-- metap via tp_apply_vacuum_shrinkage, leaving phantom tokens.
--
-- Fix: merge starts from Σ source.header.total_tokens (raw) minus a
-- dead-only fieldnorm approximation.  For all-live sources the merged
-- total_tokens is exact, so the VACUUM subtraction cancels to zero.
SET pg_textsearch.segments_per_level = 2;
CREATE TABLE merge_long_docs (id serial PRIMARY KEY, content text);
CREATE INDEX merge_long_idx ON merge_long_docs USING bm25(content)
    WITH (text_config='english');
NOTICE:  BM25 index build started for relation merge_long_idx
NOTICE:  Using text search configuration: english
NOTICE:  Using index options: k1=1.20, b=0.75
NOTICE:  BM25 index build completed: 0 documents, avg_length=0.00
-- Each doc has 100 unique tokens.  decode(encode(100)) = 96.
INSERT INTO merge_long_docs (content)
SELECT string_agg('term' || (j + i*1000), ' ')
FROM generate_series(1, 30) i,
     generate_series(1, 100) j
GROUP BY i;
SELECT bm25_spill_index('merge_long_idx');
 bm25_spill_index 
------------------
                2
(1 row)

INSERT INTO merge_long_docs (content)
SELECT string_agg('other' || (j + i*1000), ' ')
FROM generate_series(1, 30) i,
     generate_series(1, 100) j
GROUP BY i;
SELECT bm25_spill_index('merge_long_idx');
 bm25_spill_index 
------------------
               27
(1 row)

-- Sanity: both batches merged into a single L1 segment.
SELECT bm25_summarize_index('merge_long_idx') ~ E'L1 Segment'
    AS has_l1_segment;
 has_l1_segment 
----------------
 t
(1 row)

-- Delete every row so VACUUM drops the merged segment.  With the fix
-- the L1 header carries raw 6000 tokens; subtracting that from the
-- atomic/metapage total_len (also 6000) leaves 0.  Pre-fix the L1
-- header was 60 × 96 = 5760 (quantized), leaving 240 phantom tokens
-- that would bias avg_doc_len for any surviving docs and persist
-- across the next tp_sync_metapage_stats.
DELETE FROM merge_long_docs;
VACUUM merge_long_docs;
SELECT bm25_summarize_index('merge_long_idx') ~ E'total_len: 0\n'
    AS total_len_zero_after_drop,
       bm25_summarize_index('merge_long_idx') ~ E'total_docs: 0\n'
    AS total_docs_zero_after_drop;
 total_len_zero_after_drop | total_docs_zero_after_drop 
---------------------------+----------------------------
 t                         | t
(1 row)

RESET pg_textsearch.segments_per_level;
DROP TABLE merge_long_docs;
-- Clean up
DROP EXTENSION pg_textsearch CASCADE;
